NOM DU MUSEE;ADR;CP;VILLE;SITWEB;FERMETURE ANNUELLE;PERIODE OUVERTURE;JOURS NOCTURNES
Musée Municipal des Beaux-Arts de Limoges - Palais de l'Evêché;1, Place de l'Evêché;87000;LIMOGES;www.museebal.fr;1er janvier, 1er mai, 1er et 11 novembre, 25 décembre;Ouvert du 1er avril au 30 septembre de 10h à 18h du mercredi au lundi et du 1er octobre au 31 mars, le lundi et du mercredi au samedi de 10h à 12h et de 14h à 17h et le dimanche de 14h à 17h;
Musée National Adrien Dubouché;8 bis, Place Winston Churchill;87000;LIMOGES;www.musee-adriendubouche.fr;1er janvier, 25 décembre;Ouvert du mercredi au lundi de 10h à 12h30 et de 14h à 17h45;
Musée Départemental d'Art Contemporain;Place du Château;87600;ROCHECHOUART;www.musee-rochechouart.com;Entre le 15 décembre et le 1er mars;Ouvert mercredi au lundi du 1er mars au 30 septembre de 10h à 12h30 et de 13h30 à 18h et du 1er octobre au 15 décembre  de 10h à 12h30 et de 14h à 17h;
Les Sources d'Hercule;1, place Jean-Marie Keyser;54120;DENEUVRE;www.museehercule.com/;;Ouvert du 1er mai au 30 septembre lundiet mardi de 14h à 18h, les autres jours de 10h à 12h et de 14h à 18h, du 1er mars au 30 avril et en octobre les week-end,vacances scolaires de la zone A et jours fériés de 14h à 17h;
Musée de l'Histoire du Fer;"1, Avenue du Général de Gaulle
B.P. 15";54140;JARVILLE-LA-MALGRANGE;www.grand-nancy.org;1er janvier, dimanche de Pâques, 1er novembre, 25 décembre;Ouvert lundi, mercredi au vendredi de 14h à 18h, samedi, dimanche et jours fériés de 10h à 12h et de 14h à 18h;
Musée du Château de Montaigu;167, Rue Lucien Galtier;54410;LANEUVEVILLE-DEVANT-NANCY;http://www.nancy.fr/transver/coord.htm#muslor - Site du Grand Nancy;Fermé en janvier, février et mars 2005;;
Musée Municipal des Emaux et Faïences;"Port de France
Rue de la Manutention";54400;LONGWY;http://http//www.mairie-longwy.fr;1er janvier, 25 décembre, 1er mai;Ouvert de novembre à avril  de 14h à 18h du mardi au vendredi et de 10h à 12h et 14h à 18h le week-end, et de mai à octobre du mardi au dimanche de 10h à 12h et de 14h à 18h;
Musée du Château de Lunéville;Place de la Deuxième Division de Cavalerie;54300;LUNEVILLE;www.chateauluneville.cg54.fr - http://www.chateaudeslumieres.com;;Ouvert du mercredi au lundi de 10h à 12h et de 14h à 18h;
Musée des Beaux-Arts de Nancy;"3, Place Stanislas
B.P. 218";54004;NANCY;www.mairie-nancy.fr;1er janvier, 1er mai, 14 juillet, 1er novembre, 25 décembre;Ouvert du mercredi au lundi de 10h à 18h;
Musée Historique Lorrain;"Palais Ducal
64, Grande Rue";54000;NANCY;http://www.nancy.fr/transver/coord.htm#muslor - Site du Grand Nancy;1er janv., 1er mai, 14 juil., 1er nov. et 25 déc.;Ouvert du mardi au dimanche de 10h à 12h30 et de 14h à 18h;
Musée de l'Ecole de Nancy;36-38, rue du Sergent Blandan;54000;NANCY;www.ecole-de-nancy.com;1er janvier, 1er mai, 14 juillet, 1er novembre, 25 décembre;Ouvert du mercredi au dimanche de 10h à 18h. Le premier Dimanche de chaque mois de 10h30 à 13h30;
Musée de Zoologie - Aquarium Tropical;34, Rue Sainte-Catherine;54000;NANCY;www.man.uhp-nancy.fr;1er janvier, 1er mai et  25 décembre,;Ouvert tous les jours de 10h à 12h et de 14h à 18h;
"Musée ""au Fil du Papier""";"Hôtel de la Monnaie
13, Rue Magot de Rogéville";54700;PONT-A-MOUSSON;Site de la ville;1er janvier, dimanche de Pâques, 1er mai, 14 juillet, 1er novembre,  25 décembre;Ouvert du 2 mai au 30 septembre lundi, mercredi au samedi de 14h à 18h, dimanche de 10h à 12h et de 14h à 18h, du 1er octobre au 30 avril lundi, mercredi au lundi de 14h à 17h;
Musée d'Art et d'Histoire de Toul;25, Rue Gouvion Saint-Cyr;54200;TOUL;www.toul.fr;1er janvier, dimanche et lundi de Pâques, 1er mai, 14 juillet, 1er novembre, 24, 25 et 31 décembre;Ouvert du 1er octobre au 30 avril de 14h à 17h et les matins aux groupes sur réservation et du 2 mai au 30 septembre de 10h à 12h30 et de 13h30 à 18h;
Musée Barrois;Esplanade du Château;55000;BAR-LE-DUC;site de la ville - http://www.barleduc.fr;1er janvier, 1er mai, 14 juillet, 15 août, 1er novembre, 25 décembre;Ouvert du mercredi au dimanche de  14h à 18h, et tous les jours en juillet août;
Musée de la Céramique et de l'Ivoire;7, Avenue Carcano;55200;COMMERCY;;;Ouvert du 1er juillet au 1er septembre du mercredi au lundi de 14h à 18h et du 1er mai au 30 juin et du 1er septembre au 1er octobre les week-end et jours fériés de 14h à 18h. Accessible en dehors de ces périodes aux groupes et aux classes sur demande;
Musée Jules Bastien-Lepage - Musée de la Fortification;"La Citadelle
B.P. 28";55600;MONTMEDY;www.tourisme-montmedy.fr;24 décembre au 2 janvier;Ouverture en janvier du lundi au vendredi de 10h30 à 13h et de 13h30 à 17h, en février, mars tous les jours de 10h30 à 13h et de 13h30 à 17h, en avril-septembre tous les jours de 10h à 13h et de 13h30 à 18h, en octobre-novembre tous les jours de 10h30 à 1;
Musée d'Art Sacré de la Meuse;Rue du Palais de Justice;55300;SAINT-MIHIEL;http://otsisaintmihiel.e-monsite.com;;Ouvert en avril, mai et octobre les week-ends et jours fériés de 14h à 18h, de juin à septembre du mercredi au lundi de 14h à 18h y compris les jours fériés;
Musée Départemental Raymond Poincaré;Clos Raymond Poincaré;55300;SAMPIGNY;http://www.cg55.fr;;Ouvert du 15 mai au 15 octobre le lundi  et du mercredi au vendredi de 10h à 12h et de 14h à 17h30, le samedi et dimanche de 10h à 12h30 et de 13h30 à 18h;
Musée de la Bière et du Pays de Stenay;Rue de la Citadelle;55700;STENAY;www.musee-de-la-biere.com;Du 1er novembre au 31 mars;Ouvert tous les jours du 1er mars au 1er décembre de 10h à 12h et de 13h30 à 18h;
Musée d'Argonne;2, Rue Louis XVI;55270;VARENNES-EN-ARGONNE;site de la conservation : www.cg55.fr;Octobre à avril;Ouvert de mi avril à fin  juin et en septembre les week-end et jours fériés de 14h30 à 17h30, en juillet-août tous les jours de 14h30 à 17h30;
Musée Jeanne d'Arc;Hôtel de Ville;55140;VAUCOULEURS;;;Ouvert de mai à septembre du lundi au vendredi de 10h à 12h et de 14h à 18h, samedi, dimanche et jours fériés de 14h à 18h.;
Musée de la Princerie;16, Rue de la Belle Vierge;55100;VERDUN;www.musee-princerie.fr;Novembre à mars;Ouvert du mercredi au lundi de 9h30 à 12h et de 14h à 18h du 1er avril au 31 octobre;
Musée Départemental de la Guerre de 70;11, Rue de Metz;57130;GRAVELOTTE;http://www.cg57.fr/vivrelamoselle/Pages/Tourisme/museesdepartementaux/MuseeGravelotte.aspx;;;
Musée Départemental du Sel;Porte de France;57630;MARSAL;Site du conseil général - www.mosellepassion.fr;1er mai, 22 décembre au 7 janvier;Ouvert du mardi au dimanche de 9h30 à 12h et de 13h30 à 18h;
Maison du Verre et du Cristal;Place Robert Schumann;57960;MEISENTHAL;http://www.musee-verre.webmuseo.com/;De Novembre à Pâques;Ouvert de Pâques au 31 octobre de 14h à 18h du mercredi au lundi + saison Noël du 9 novembre au 29 décembre de 14h à 17h;
Musées de la Cour d'Or;2, Rue du Haut Poirier;57000;METZ;www.musee.metzmetropole.fr;1er janvier, Vendredi Saint, 1er et 8 mai, Ascension, 14 juil, 15 août, 1er et 11 novembre, 25 décembre, et 24 et 31 décembre après-midi;Ouvert du mercredi au lundi de 9h à 18h;
Centre Pompidou de Metz;"1, Parvis des Droits-de-l'Homme
CS 90490";57020;METZ Cedex 1;www.centrepompidou-metz.fr;;Ouvert lundi et mercredi de 11h à 18h, jeudi et vendredi de 11h à 20h, samedi de 10h à 20h, dimanche de 10h à 18h;jusqu'à 20 h jeudi à samedi jusqu'en avril et samedi à partir de mai
Musée des Mines de fer de Lorraine;Lieu dit Haméviller;57700;NEUFCHEF;www.musee.desminesdefer-lorraine.com;;Ouvert du mardi au dimanche de 14h à 18h toute l'année, pour les groupes de 8h30 à 18h tous les jours;
Musée de la Mine - Carreau Wendel;Parc Explor Wendel;57540;PETITE-ROSSELLE;www.musee-les-mineurs.fr;25 et 26 décembre et 1ère semaine de janvier;Ouvert du mardi au dimanche de 10h à 18h;
Musée Militaire et Erckmann-Chatrian;"Hôtel de Ville
Place d’Armes";57370;PHALSBOURG;www.phalsbourg.fr/La_culture__les_loisirs/Le_Musee;Jours fériés;Ouvert du lundi au vendredi de 9h à 12h et de 13h30 à 17h, le samedi de 10h à 12h, en juillet-août samedi et dimanche de 10h à 12h et de 14h à 17h;
Musée du Pays de Sarrebourg;Rue de la Paix;57400;SARREBOURG;www.ville-sarrebourg.fr/Culture/Musee;le 1er janvier, le jour de Pâques, le 1er mai, le 25 et 26 décembre;Ouvert du mercredi au samedi de 10h à 12h et de 14h à 18h et le dimanche et jours fériés de 14h à 18h;
Jardin d'Hiver, Musée de La Faïence;15-17, Rue Poincaré;57200;SARREGUEMINES;www.sarreguemines-museum.com;1er Janvier, Dimanche de Pâques, 1er Mai, 25 Décembre;Ouvert du mardi au dimanche de 10h à 12h et de 14h à 18h + lundis fériés;
Moulin de la Blies - Musée des Techniques Faïencières;125, Avenue de la Blies;57200;SARREGUEMINES;www.sarreguemines-museum.com;1er Janvier, Dimanche de Pâques, 1er Mai, 1er Novembre et 25 Décembre;Ouvert du mardi au dimanche & lundis fériés de 10h à 12h et de 14h à 18h du 1er novembre au 31 mars et du 1er avril au 31 octobre de 10h à 18h;
La Tour aux Puces - Musée du Pays Thionvillois;"Cour du Château
B.P. 30352";57125;THIONVILLE Cedex;www.tourauxpuces.com;Dimanche de Pâques, 1er novembre, 25 et 26 décembre, 1er janvier;Ouvert du mardi au dimanche de 14h à 18h du 16 septembre au 14 juin, du mardi au dimanche de 9h30 à 11h30 et de 14h à 18h du 15 juin au 15 septembre;
Musée Départemental Georges de la Tour;"Hôtel de la Monnaie
Rue Vignon";57630;VIC-SUR-SEILLE;www.cg57.fr/culture/1-8-delatour.asp;1er mai, 23 décembre au 7 janvier inclus;Ouvert du mardi au dimanche de 9h30 à 12h et de 13h30 à 18h;
Musée de l'Image;42 quai de Dogneville;88000;EPINAL;www.museedelimage.fr;25 décembre, 1er janvier et le mardi suivant Päques;Ouvert tous les jours du 1er septembre au 30 juin de 9h30 à 12h et de 14h à 18h, vendredi de 9h30 à 18h, dimanche et jours fériés de 10h à 12h et de 14h à 18h, en juillet-août tous les jours de 9h30 à 12h30 et de 13h30 à 18h30, vendredi de 9h30 à 18h30, d;
Musée Départemental d'Art Ancien et Contemporain;"1, Place Lagarde
B.P. 436";88011;EPINAL Cedex;Site du conseil général - www.vosges.fr;1er Janvier, 1er mai, 1er novembre et 25 décembre;Ouvert le lundi et du mercredi au samedi de 9h à 12h30 et de 13h30 à 18h, le dimanche de 13h30 à 18h;
Musée de la Lutherie;B.P. 189;88507;MIRECOURT CEDEX;www.musee-lutherie-mirecourt.fr;1er janvier, 1er mai, 25 décembre et 15 jours en janvier;Ouvert de mai à septembre du lundi au samedi de 10h à 12h et de 14h à 18h, d'octobre à avril mercredi et samedi de 10h à 12h et de 14h à 18h, petites vacances scolaires (3 zones) lundi et du mercredi au samedi de 10h à 12h et de 14h à 18h, dimanche et jou;
Musée Louis Français;30, Avenue Louis Français;88370;PLOMBIERES-LES-BAINS;site de la ville;;Ouvert en 2013 en visite guidée accompagnée et lors de certaines grandes manifestations organisées par la ville;
Musée Charles de Bruyères;70, Rue Charles de Gaulle;88200;REMIREMONT;www.remiremont.fr/culture/musees.php;1er janvier, 1er mai, Ascension, Toussaint, 25 décembre, en octobre;Ouvert de janvier à mars du lundi au samedi de 14h à 18h, et en avril de 14h à 18h et de mai à septembre de 10h à 12h et de 14h à 18h, de novembre à décembre de 14h à 18h du mercredi au lundi;
Musée Charles Friry;12, Rue du Général Humbert;88200;REMIREMONT;www.remiremont.fr/culture/musees.php;1er janvier, 1er mai, Ascension, Toussaint, 25 décembre, en octobre;Ouvert de janvier à mars du lundi au samedi de 14h à 18h, et en avril de 14h à 18h et de mai à septembre de 10h à 12h et de 14h à 18h, de novembre à décembre de 14h à 18h du mercredi au lundi;
Musée Pierre Noël - Musée de la Vie dans les Hautes-Vosges;11, rue Saint-Charles;88100;SAINT-DIE-DES-VOSGES;Site de la ville - www.ville-saintdie.fr;Jours fériés;Ouvert de mai à mi-octobre du mardi au samedi de 10h à 12h et de 14h à 18h, le dimanche de 14h à 18h, et de mi-octobre à avril du mardi au dimanche de  14h à 18h + mercredi de 10h à 12h;
Musée Départemental d'Archéologie Précolombienne et de Préhistoire de la Martinique;9, rue de la Liberté;97200;FORT-DE-FRANCE;www.cg972.fr/mdap;;Ouvert le lundi de 13h à 17h,  du mardi au vendredi de 8h à 17h, le samedi de 9h à 12h;
Musée Régional d'Histoire et d'Ethnologie;10, Boulevard du Général de Gaulle;97200;FORT-DE-FRANCE - MARTINIQUE-;http://www.cr-martinique.fr/francais/institution/serv-region/musees/histoire_ethno.htm;;Ouvert le lundi, mercredi à vendredi de 8h30 à 17h, le mardi de 14h à 17h, le samedi de 8h30 à 12h;
Muséum d'Histoire Naturelle;B.P. 4030;97254;FORT-DE-FRANCE TERRE-SAINVILLE Cedex;;;;
Musée de La Canne;Quartier Vatable;97229;LES TROIS ILETS;http://www.zananas-martinique.com/martinique-patrimoine/maison-de-la-canne.html;;Ouvert du mardi au jeudi de 8h30 à 17h30, vendredi et samedi de 8h30 à 17h et le dimanche de 9h à 17h;
Ecomusée de la Martinique;Anse Figuier;97211;RIVIERE-PILOTE;/www.cr-martinique.fr/francais/institution/serv-region/musees/ecomusee.htm;;Ouvert du mardi au jeudi de 8h30 à 17h30, le vendredi de 8h30 à 17h, le samedi de 8h30 à 13h et de 14h à 17h, le dimanche de 9h à 13h et de 14h à 17h;
Musée Volcanologique Franck Arnold Perret;Rue Victor Hugo;97250;SAINT-PIERRE;http://www.saintpierre-martinique.fr;1er janvier;Ouvert tous les jours de 9h à 17h;
Musée Départemental de l'Ariège;Rue du Rocher;9000;FOIX;www.sesta.fr ou www.ariege.com/chateaufoix/index.html;1er septembre, 25 décembre, 1er janvier;Ouvert de janvier à avril et d'octobre à décembre de 10h30 à 12h et de 14h à 17h30, en janvier la 1ère semaine puis seulement les week-ends, en mai de 10h30 à12h et de 14h à 17h30 en semaine et de 9h45 à 12h et de 14h à 18h les week-ends et jours fériés,;
Musée du Textile et du Peigne en Corne;65, Rue Jean Jaurès;9300;LAVELANET;www.paysdolmes.org - www.geocities.com/amtpc2000;1er mai;Ouvert en juillet et août de 14h à 19h et de mi-avril à mi-octobre de 14h à 18h du mardi au dimanche;
Musée de la Préhistoire;Place de l'Eglise;9290;LE MAS D'AZIL;www.grotte-masdazil.com;Janvier, 25 décembre;Ouvert en février, mars vacances et dimanches de 14h à 18h, d'avril à juin et septembre du mardi au dimanche de 14h à 18h, juillet/août tous les jours de 11h à 13h et de 14h à 19h, octobre/novembre les dimanches, jours fériés et vacances de 14h à 18h (fer;
Musée de la Forge;Route de Paris;9330;MONTGAILHARD;www.sesta.fr;25 décembre et 1er janvier;Ouvert lors des vacances d'hiver toutes zones, les vacances de Noël et du 1er dimanche d'avril au 30 juin tous les jours de 10h à 12h et de 13h30 à 18h, le dimanche et jours fériés de 10h à 12h et de 13h30 à 18h30, en juillet-août tous les jours de 10h à;
Musée d'Archéologie;32, Village;9300;MONTSEGUR;Site de la ville : www.citaenet.com/montsegur;Janvier et 25 décembre;Ouvert de février à mars de 14h à 19h, en avril de 14h à 18h, de mai à septembre de 11h à 13h et de 14h à 19h, en octobre de 14h à 18h et de novembre à décembre de 14h à 17h;
Musée du Palais des Evêques;Route de Montjoie;9190;SAINT-LIZIER;Site du Service d'exploitation des sites touristiques de l'Ariège - www.sesta.fr ou www.grands-sites-ariege.fr;1er janvier, du 7 janvier au 22 février, du 11 mars au 30 mars, du 4 au 8 novembre et du 12 novembre au 21 décembre, 25 décembre;Ouvert de 14h à 18h du 2 au 5 janvier, du 25 février au 10 mars, du 31 mars au 30 juin, du 17 septembre au 3 novembre et du 22 au 31 décembre et de 10h30 à 19h du 1er juillet au 15 septembre;
Musée Régional de Géologie Pierre Vetter;Avenue Paul Ramadier;12300;DECAZEVILLE;www.decazeville.fr ou www.musees-midi-pyrenees.fr;;Ouvert du mardi au samedi de 10h à 12h et de 14h à 18h. Ouvert le dimanche et le lundi uniquement sur réservation pour les groupes;
Musée des Mœurs et Coutumes, Musée du Rouergue;Place Frontin;12500;ESPALION;www.aveyron-culture.com;Octobre à mai;Ouvert de juin à septembre du mardi au dimanche de 10h à 12h et de 14h à 18h. Accueil des groupes sur rendez-vous;
Musée Joseph Vaylet;"Ancienne église St. Jean Baptiste
35, rue Droite";12500;ESPALION;www.tourisme-espalion.fr - http://www.museeduscaphandre.com;Les autres mois;Ouvert de juin à septembre du mardi au dimanche de 10h à 12h et de 14h à 18h. Accueil des groupes sur rendez-vous;
Musée Municipal de Millau;"Hôtel de Pégayolles
Place du Maréchal Foch";12100;MILLAU;www.millauculture.fr ou www.ot-millau.fr;Jours fériés d'octobre à mai;Ouvert de mai à juin, en septembre et d'octobre à mars du lundi au samedi de 10h à 12h et de 14h à 18h, en juillet-août tous les jours de 10h à 18h;
Musée des Beaux-Arts Denys Puech;Place Georges Clemenceau;12000;RODEZ;http://musee-denys-puech.grand-rodez.com/;1er janvier, 1er mai, 1er novembre et 25 décembre;Ouvert du mardi au vendredi de 10 h à 12 h et de 14 h à 18 h, samedi et dimanche de 14h à 18h;
Musée Fenaille;14, Place Eugène Raynaldy;12000;RODEZ;www.musee-fenaille.com ou www.grandrodez.com;1er janvier, 1er mai, 1er novembre, 25 décembre;Ouvert mardi, jeudi et vendredi de 10h à 12h et de 14h à 18h, mercredi et samedi de 13h à 19h, dimanche de 14h à 18h - Du 1er juillet au 31 août mardi, jeudi, vendredi de 10h à 18h et mercredi, samedi de 12h à 18h. Du 15 juillet au 15 août ouvert tous les;
Musée Soulages;"Communauté d'agglomération du Grand Rodez
1, Place Adrien-Rozier - B.P. 531";12005;RODEZ Cedex;www.grand-rodez.com ou http://musee-soulages.grand-rodez.com/;;;
Musée Municipal d'archéologie;Rue Saint-Pierre;12250;ROQUEFORT-SUR-SOULZON;;;;
Musée des Arts et Métiers;;12330;SALLES-LA-SOURCE;www.musees-aveyron.fr;De novembre à mars;"Ouvert en avril et octobre les mercredi , jeudi et dimanche de 14h à 18h, mai/juin/septembre du mercredi au lundi de 14h à 18h, juillet-août du mardi au vendredi de 10h à 12h30 et de 13h30 à 18h30, les samedi, dimanche et lundi de 13h30 à 18h30
Visites";
Musée du Charroi Rural et de l'Artisanat Traditionnel;Ancienne Eglise Saint-Firmin;12120;SALMIECH;www.musee-charroi-rural-salmiech.fr;;Ouvert en Juillet et Août tous les jours de 11h à 12h et de 14h30 à 18h30. Autres jours de l'année, sur rendez-vous;
Musée Municipal Urbain Cabrol;Place de la Fontaine;12200;VILLEFRANCHE-DE-ROUERGUE;www.villefranchederouergue.fr;Jours fériés;Ouvert d'avril à juin et septembre du mardi au samedi de 14h à 18h, juillet-août du mardi au samedi de 10h à 12h et de 14h30 à 18h30;
Musée des Jacobins;4, Place Louis Blanc;32000;AUCH;www.musee-jacobins.auch.fr www.auch-tourisme.com ou site de la mairie;Janvier et jours fériés;Ouvert du 1er février au 31 mars tous les jours de 10h à 12h et de 14h à 18h et du 1er novembre au 31 décembre du lundi au vendredi de 14h à 17h, samedi et dimanche de 10h à 12h et de 14h à 17h;
Musée de l'Armagnac;2, Rue Jules Ferry;32100;CONDOM;site du département : www.gers-gascogne.com;Janvier;Ouvert de novembre à mars du mercredi au dimanche de 14h à 17h et d'avril à octobre du mercredi au lundi de 10h à 12h et de 15h à 18h;
Musée Archéologique;Place de la République;32180;EAUZE;site du département : www.gers-gascogne.com ou site de la mairie;Janvier,  1er week-end de juillet;Ouvert du 1er mars au 30 juin et du 1er septembre au 30 novembre tous les jours de 10h à 12h et de 14h à 18h, du 1er juillet au 31 août tous les jours de 10h à 19h;
Musée Campanaire;Place de l'Hôtel de ville;32600;L'ISLE JOURDAIN;site du département : www.gers-gascogne.com;1er janvier au 15 janvier, 1er mai, 25 décembre;Ouvert du 15 juin au 14 septembre de 10h à 12h et de 14h30 à 18h30, du 15 septembre au 14 juin de 10h à 12h et de 14h30 à 17h30;
Musée d'Archéologie;"Place du Général de Gaulle
Hôtel de Ville";32700;LECTOURE;site du département : www.gers-gascogne.com;Jours fériés;Ouvert du mercredi au lundi du 1er février au 30 avril et du 1er novembre au 31 décembre de 14h à 17h et du 1er mai au 31 octobre de 10h à 12h et de 14h à 17h;
Musée Joseph Abeilhe;"Mairie de Marciac
19, Place de l'Hôtel de Ville";32230;MARCIAC;Site de la région : www.musees-midi-pyrenees.fr;;Ouvert du lundi au vendredi de 8h30 à 12h et de 13h30 à 17h;
Musée des Beaux-Arts et des Arts Décoratifs;13, rue de l'Evêché;32300;MIRANDE;site du département : www.gers-gascogne.com;Jours fériés;Ouvert du lundi au vendredi de 9h à 12h et de 14h à 18h, le samedi de 10h à 12h et de 15h à 18h, et le dimanche de 10h à 12h en juillet août;
Musée de Préhistoire;Avenue de Benabarre;31420;AURIGNAC;www.musee-aurignacien.com;;Ouvert du mardi au dimanche de 10h à 17h;
Musée du Pays de Luchon;18, Allée d'Etigny;31110;BAGNERES-DE-LUCHON;www.luchon.com ou www.mairies-luchon.fr -www.musees-midi-pyrenees.fr;Jours fériés;Ouvert en janvier et décembre le mardi, jeudi et vendredi de 10h à 12h et de 15h à 18h, le mercredi, samedi et dimanche de 9j à 12h et de 14h à 18h. De février à juin et de septembre à octobre le lundi, mardi, jeudi et vendredi de 10h à 12h et de 15h à 18;
Musée Municipal;Place Henri Dulion;31220;MARTRES-TOLOSANE;www.tourisme-martres-tolosane.fr;Première semaine de janvier;Ouvert du mardi au vendredi de 9h30 à 12h30 et de 13h30 à 17h30  de décembre à février - de mars à mi-juin et de mi-septembre à fin novembre du mardi au samedi de 9h30 à 12h30 et de 13h30 à 17h30 - de mi-juin à mi septembre tous les jours et jours fériés;
Musée Archéologique Départemental;Bâtiment de l'Ancienne Gendarmerie;31510;SAINT-BERTRAND-DE-COMMINGES;http://www.musees-midi-pyrenees.fr/musees/musee-archeologique-departemental;Janvier;Expositions temporaires tous les jours de 10h à 18h de février à décembre;
Musée Municipal d'Art et d'Histoire;6, place de Mas Saint Pierre;31800;SAINT-GAUDENS;www.mairiestgaudens.fr;;Exposition hors les murs ouvert du 7 juillet au 10 novembre 2012 du lundi au samedi de 10h à 12h et de 14h30 à 18h;
Musée des Augustins;21, rue de Metz;31000;TOULOUSE;www.augustins.org;;Ouvert tous les jours de 10h à 18h. Nocturne le mercredi jusqu'à 21h;Mercredi jusqu'à 21h
Musée Saint-Raymond;Place Saint Sernin;31000;TOULOUSE;www.SaintRaymond.toulouse.fr;1er janvier, 1 mai et 25 décembre;Ouvert tous les jours de 10h à 18h, de 10h à 19h du 1er juillet au 31 août. Fermeture exceptionnelle à 17h les 24 et 31 décembre;
Musée des Transports et des Communications;93, avenue Jules Julien;31400;TOULOUSE;http://asptuit.free.fr;;Ouvert les jeudis de 10h à 12h et de 14h à 16h et sur rendez-vous;
Musée du Vieux Toulouse;"Hôtel Dumay
7, Rue du May";31000;TOULOUSE;En projet;Jours fériés;Ouvert de mi-avril à début novembre du lundi au samedi de 14h à 18h. Ouvert toute l'année sur rendez-vous pour les groupes.;
Musée Georges Labit;17, rue du Japon;31400;TOULOUSE;;Jours fériés;Ouvert du mardi au dimanche de 10h à 17h d'octobre à mai et de 10h à 18h de juin à septembre;
Musée Paul Dupuy;13, Rue de la Pléau;31000;TOULOUSE;Site des musées de la région : www.musees-midi-pyrenees.fr/;Jours fériés;Ouvert du mardi au dimanche de 10h à 17h d'octobre à mai et de 10h à 18h de juin à septembre;
Les Abattoirs, Musée d'Art Moderne et Contemporain;76, allées Charles-de-Fitte;31300;TOULOUSE;www.lesabattoirs.org;1er janvier, 1er mai et 25 décembre;Ouvert du mercredi au vendredi de 10h à 18h et du samedi et dimanche de 11h à 19h en été de 11h à 19h;
Muséum d'Histoire Naturelle;35, allées Jules Guesde;31000;TOULOUSE;www.museum.toulouse.fr;1er janvier, 1er mai, 25 décembre;Ouvert de 10h à 18h du mardi au dimanche;
Musée Bigourdan du Vieux Moulin;Rue Hount-Blanque;65200;BAGNERES-DE-BIGORRE;;;;
Musée Salies;Place des Thermes;65200;BAGNERES-DE-BIGORRE;www.museesbagneres.fr/;;Ouvert du mercredi au dimanche de 10h à 12h et de 14h à 18h, samedi et dimanche de 15h à 18h;
Muséum d'Histoire Naturelle;7, Place des Thermes de Salut;65200;BAGNERES-DE-BIGORRE;www.museesbagneres.fr/;;Ouvert de mai à octobre du mercredi au dimanche de 15h à 18h, de novembre à avril le mercredi et dimanche de 15h à 18h;
Musée Pyrénéen;Château fort;65100;LOURDES;www.chateaufort-lourdes.fr ou site de la ville - http://www.lourdes-visite.com/;1er & 11 novembre, 25 décembre et 1er janvier;Ouvert du 1er avril au 30 septembre de 9h à 12h et de 13h30 à 18h30 et du 1er octobre au 31 mars de 9h à 12h et de 14h à 18h (17h le vendredi);
Musée Municipal;Presbytère;65120;LUZ-SAINT-SAUVEUR;;;Ouvert tous les jours de juin à septembre de 16h à 18h30;
Musée-château Gaston Phébus;Château-Fort de Mauvezin;65130;MAUVEZIN;www.chateaudemauvezin.com;;Ouvert tous les jours du 15 octobre au 14 avril de 13h30 à 17h30 et du 15 avril au 14 octobre de 10h à 19h;
Musée Massey;"Rue Achille Jubinal
Jardin Massey";65000;TARBES;www.musee-massey.com;1er janvier, 1er mai, 25 décembre;Ouvert du mercredi au lundi de 10h à 12h et de 14h à 17h du 16 octobre au 14 avril et de 10h à 19h du 15 avril au 15 octobre;
Musée de Préhistoire de Cabrerets;"Centre de Préhistoire du Pech Merle
Mairie";46330;CABRERETS;www.pechmerle.com;15 décembre au 15 janvier;Ouvert tous les jours du d' avril au 11 novembre 2012 de 9h45 à 12h45 et de 13h45 à 18h30;
Musée Henri Martin;792, Rue Emile Zola;46000;CAHORS;www.mairie-cahors.fr/musee;1er janvier, 1er mai, 25 décembre et pendant les montages d'expositions;Ouvert du mercredi au lundi de 11h à 18h, dimanche et jours fériés de 14h à 18h;
Musée d'Histoire de Figeac;"Rue Victor Delbos
Cour du Puy";46100;FIGEAC;http://www.musee-champollion.fr/;;Ouvert en juillet – août de 14h30 à 18h30, tous les jours, et pour les groupes, sur réservation auprès du musée Champollion;
