NOM DU MUSEE;ADR;CP;VILLE;SITWEB;FERMETURE ANNUELLE;PERIODE OUVERTURE;JOURS NOCTURNES
Musée des Beaux-Arts;"Direction des musées d'Angers
14, Rue du Musée";49100;ANGERS;www.angers.fr/mba;1er janvier, 1er mai, 1er et 11 novembre et 25 décembre;Ouvert du 1er octobre au 31 mai du mardi au dimanche de 10h à 12h et de 14h à 18h (collections permanentes) et de 10h à 18h (expositions temporaires), du 1er juin au 30 septembre tous les jours de 10h à 18h30;Nocturnes événementielles
Musée Pincé;32 bis rue Lenepveu;49100;ANGERS;Site de la ville;;;
Muséum des Sciences Naturelles;43, Rue Jules Guitton;49100;ANGERS;www.ville-angers.fr/museum;1er janvier, 1er mai, 1er et 11 novembre et 25 décembre;Ouvert du mardi au dimanche de 14h à 18h. Le matin pour les groupes sur réservation;
Musée d'Art et d'Histoire;"Château du Roi René d'Anjou
place de l'Europe";49150;BAUGE;www.damm49.fr;Janvier, février,mars;Ouvert du 23 février au 10 mars et du 13 avril au 16 juin du mercredi au dimanche de 14 à 18h et du 17 juin au 8 septembre  tous les jours de 10h à 12h30 et de 13h30 à 18h, du 9 septembre au 11 novembre du mercredi au dimanche de 14 h à 18h;
Musée Joseph Denais;5, Place Notre-Dame;49250;BEAUFORT-EN-VALLEE;www.damm49.fr;;Ouvert du 31 mars au 18 avril et du 27 mai au 14 juin et du 16 septembre au 18 octobre les week-end et jours fériés de 14h30 à 18h, du 19 avril au 26 mai du vendredi au dimanche et jours fériés de 14h30 à 18h, du 15 juin au 15 septembre et du 19 octobre a;
Musée du Textile;Rue du Docteur Roux;49300;CHOLET;www.museedutextile.com ou www.ville-cholet.fr/musee-textile.php;1er janvier, 1ermai, 25 décembre;Ouvert du mercredi au dimanche de 10h à 12h et de 14h à 18h, en juillet-août ouverture supplémentaire le mardi. Ouvert tous les jours pour les groupes;
Musée d'Art et d'Histoire;27, Avenue de l'Abreuvoir;49300;CHOLET;Site de la ville : www.ville-cholet.fr/musee-art-histoire.php;1er janvier, 1er mai, 25 décembre;Ouvert du mercredi au dimanche de 10h à 12h et de 14h à 18h, en juillet-août tous les jours de 10h à 12h et de 14h à 18h. Ouvert pour les groupes tous les jours sauf le lundi matin;
Musée Jules-Desbois;1, Place Jules-Desbois;49390;PARCAY-LES-PINS;www.musee-julesdesbois.fr ou www.damm49.fr;Janvier, février, mars;Ouvert du 31 mars au 14 juin et du 16 septembre au 1er novembre les week-ends et jours fériés de 14h30 à 18h et du 15 juin au 15 septembre du mardi au dimanche de 11h à 13h et de 14h30 à 18h;
Musée de la Vigne et du Vin d'Anjou;"Les Celliers de la Coudraye
Place des Vignerons";49750;SAINT LAMBERT-DU-LATTAY;www.mvvanjou.com;3 semaines de fermeture annuelle;Ouvert du 1er avril  au 30 juin et du 1er septembre au 11 novembre du mercredi au vendredi de 14h30 à 17h30 et  le week-end  et jour férié de 14h30 à 18h30. Du 1er juillet au 31 août tous les jours de 11h à 13h et de 15h à 19h. Toute l'année sur réservati;
Château-Musée;"Hôtel de Ville
Rue Molière - CS 54006";49408;SAUMUR Cedex;www.chateau-saumur.com;;Ouvert du mardi au dimanche et les lundi fériés de 10h à 13h et de 14h à 17h30 du 30 mars au 14 juin et du 16 septembre au 3 novembre (basse saison)  et du 15 juin au 15 septembre tous les jours de 10h à 18h30 (haute saison);
Musée de l'Ardoise;32, Chemin de la Maraîchère;49800;TRELAZE;www.lemuseedelardoise.fr;24 décembre au 2 janvier;Ouvert du 15 février au 30 juin et du 1er septembre au 30 novembre du mardi au vendredi  de 10h à 12h et de 14h à 17h et week-end, et jours fériés et vacances scolaires de 14h30 à 18h30, en juillet-août du mardi au dimanche et jours fériés de 10h à 12h et;
Musée des Tisserands Mayennais;Place Billard de Veaux;53300;AMBRIERES-LES-VALLEES;Site de la ville;;Ouvert en juillet août de 14h30 à 18h30 du mardi au dimanche. Ouvert pour les groupes sur rendez-vous toute l'année;
Musée d'Art et d'Archéologie Hôtel Fouquet;2, Rue Jean Bourré;53200;CHATEAU-GONTIER;http://patrimoine.chateaugontier.fr/;;Ouvert d'avril à juin les jours fériés de 14h à 18h, de juillet à septembre tous les vendredis et jours fériés de 14h à 18h. Ouvert toute l'année sur rendez-vous;
Musée Communal Robert Tatin;"""La Maison des Champs""
La Frénouse";53230;COSSE-LE-VIVIEN;www.musee-robert-tatin.fr;Janvier, 25 décembre;Ouvert du 1er avril au 30 septembre tous les jours de 10h à 19h et du 1er octobre au 31 mars tous les jours de 14h à 18h. Ouvert toute l'année pour les groupes sur réservation;
Musée Municipal;Place de l'Hôtel de Ville;53500;ERNEE;;;Ouvert le lundi de 14h à 18h, du mardi au vendredi de 9h30 à 12h30 et de 13h30 à 18h, le samedi de 9h30 à 12h30 en juillet-août;
Musée Archéologique Départemental de Jublains;"13, Rue de la Libération
B.P. 1";53160;JUBLAINS;site du conseil général - www.cg53.fr ou lamayenne.fr;15 décembre au 5 janvier;Ouvert d'octobre à fin avril de 9h30 à 12h30 et de 13h30 à 17h30 du jeudi au mardi, en mai, juin et septembre tous les jours de 9h à 12h30 et de 13h30 à 18h, en juillet-août de 9h à 18h tous les jours;
Musée des Sciences - CCSTI;21, Rue du Douanier Rousseau;53000;LAVAL;www.multimedia.com/ccstidelaval;Jours fériés;Ouvert tous les jours de 10h à 12h et de 14h à 18h pour les individuels et du lundi au vendredi de 9h à 12h et de 13h30 à 17h30 pour les groupes;
Musée du Vieux Château;Place de la Trémoille;53000;LAVAL;Site de la mairie - http://musees.laval.fr;1er janvier, Pâques, Pentecôte, 1er mai, 8 mai, Ascension, 14 juillet, 15 août, 1er novembre, 11 novembre et 25 décembre;Ouvert du 1er juin au 30 septembre du mardi au samedi de 10h à 12h et de 14h à 18h, dimanche, 14 juillet et 15 août de 14h à 18h, du 1er octobre au 31 mai du mardi au samedi de 9h30 à 12h30 et de 13h30 à 19h et le matin sur rdv (groupes & écoles), le dima;
Musée du Château;Place Juhel;53100;MAYENNE;www.museeduchateaudemayenne.fr;Janvier, 25 décembre, 1er mai;Ouvert d'octobre à février de 10h à 12h30 et de 14h à 17h, de mars à mai de 10h à 12h30 et de 14h à 18h et de juin à septembre de 10h à 19h;
Musée de l'Ardoise et de la Géologie;"""Longchamp""";53800;RENAZE;http://geocities.com/musardoise;;Ouvert dimanche et jours fériés en mai, juin, septembre, octobre, du mercredi au dimanche et jours fériés en juillet-août de 14h à 17h30. Pour les groupes toute l'année sur réservation;
Musée Heurteloup-Chevalier;;72500;CHATEAU-DU-LOIR;;;;
Musée Vert Véron-de-Forbonnais;204, Avenue Jean-jaurès;72100;LE MANS;site de la ville;;Ouvert du lundi au vendredi de 9h à12h et de 14h à 18h, dimanche de 14h à 18h;
Musée de la Reine Bérengère;Rue de la Reine Bérengère;72000;LE MANS;Site de la ville - www.ville-lemans.fr;1er janvier;Ouvert du mardi au dimanche de 14h à 18h d'octobre à mai et de juin à septembre du mardi au dimanche de 10h à 12h30 et de 14h à 18h;
Musée de Tessé;2, Avenue de Paderborn;72000;LE MANS;site de la ville - www.ville-lemans.fr;;Ouvert du 1er septembre au 30 juin du mardi au samedi de 9h à 12h et de 14h à 18h, dimanche et jours fériés de 10h à 12h30 et de 14h à 18h en juillet-août du mardi au dimanche de 10h à 12h30 et de 14h à 18h30;
Musée Espace Faïence de Malicorne;"24, Rue Victor Hugo
B.P. 10";72270;MALICORNE-SUR-SARTHE;www.espacefaience.fr;;Ouvert de novembre à Pâques du mercredi au lundi de 10h à 12h30 et de 14h30 à 18h30, et de Pâques à la Toussaint tous les jours de 10h à 19h;
Bibliothèque-musée;Rue Charles-Garnier;72120;SAINT-CALAIS;www.saint-calais.fr;;Ouvert le mercredi de 10h à 12h et de 15h à 18h30, premier samedi du mois de 10h à 12h30  (ou en fonction des demandes;
Centre Minier de Faymoreau;"""La Cour""";85240;FAYMOREAU;www.centre-minier-vendee.com;Janvier, 24 et 31 décembre;Ouvert en février-mars et octobre à décembre  le mercredi, samedi et dimanche de 14h à 18h, d'avril à juin et septembre du mardi au dimanche de 14h à 19h, en juillet-août tlj de 10h à 19h;Tous les jeudis en juillet et août de 21h à 0h30
Musée de Fontenay-le-Comte;Place du 137ème Régiment d'Infanterie;85200;FONTENAY-LE-COMTE;;1er janvier, 1er mai, 25 décembre;Ouvert de 14h à 18h du mardi au dimanche  durant les vacances de Toussaint et d'hiver pour toutes les zones et du 1er avril au 30 septembre et le mercredi du 1er octobre au 31 mars;
Ecomusée du Marais Breton Vendéen;Le Daviaud;85550;LA BARRE-DE-MONTS;www.ecomusee-ledaviaud.com;11-nov;Ouvert du 9 février au 30 avril et du 22 septembre au 9 novembre du mardi au samedi de 14h à 18h le dimanche et jours fériés de 15h à 18h, du 1er mai au 30 juin, 1er septembre au 21 septembre tlj de 10h à 19h, dimanche et jours fériés de 14h à 19h. Juille;
Musée des Traditions;Place de l'Eglise;85680;LA GUERINIERE;www.ile-noirmoutier.com/html/activites;Novembre à mars;Ouvert du mardi au samedi du 1er avril au 30 juin et du 1er septembre au 31 octobre de 10h à 12h30 et de 14h30 à 18h et tous les jours en juillet-août de 10h à 12h30 et de 15h à 19h;
Musée Municipal;Rue Jean Jaurès;85000;LA ROCHE-SUR-YON;site de la ville;;Ouvert du mardi au samedi de 13h à 18h. Visites commentées et accueil des groupes du mardi au vendredi de 9h à 12 h et de 13 h à 17 h (sur Rendez-vous);
Musée ornithologique Charles-Payraudeau;4, Rue des Noyers;85310;LA-CHAIZE-LE-VICOMTE;www.lachaizelevicomte.fr/fr/information/6403/musee-ornithologique-charles-payraudeau;;Ouvert du lundi au jeudi de 8h30 à 13h et de 13h30 à 17h;
Historial et Mémorial de la Vendée;;85170;LES LUCS-SUR-BOULOGNE;www.historial.vendee.fr;25 décembre, 1er janvier;Ouvert du mardi au dimanche de 10h à 19h du 1er avril au 30 septembre, et de 10h à 18h du 1er octobre au 31 mars, en juillet-août tous les jours de 10h à 19h;tous les mardi jusqu'à 22h30 en juillet-août
Musée de l'Abbaye de Sainte-Croix;Rue de Verdun;85100;LES SABLES D'OLONNE;www.lessablesdolonne.fr;Jours fériés;Ouvert du mardi au dimanche du 15 juin au 30 septembre du mardi au dimanche  de 13h à 19h et du 1er octobre au 14 juin du mardi au dimanche de 14h30 à 17h30;
Musée du Nord de la Vendée;"Place de l'Hôtel de ville
B.P. 227";85602;MONTAIGU Cedex;www.ville-montaigu.fr;;Ouvert tous les jour du mercredi au lundi de 10h à 12h et 14h et 18h au mois de mai;
Musée Clemenceau et de Lattre-de-Tassigny;1, rue Plante-Choux;85390;MOUILLERON-EN-PAREDS;www.musee-deuxvictoires.fr;les 1er mai, 25 décembre et 31 décembre;Ouvert du 15 avril au 15 octobre de 9h30 à 12h et de 14h à 18h et du 16 octobre au 14 avril de 10h à 12h et de 14h à 17h;
Musée de la Construction Navale Artisanale;"Rue de l'Ecluse
Le Port";85330;NOIRMOUTIER EN L'ILE;Site Vendée-Tourisme;;;
Musée du Château;Place d'Armes;85330;NOIRMOUTIER-EN-L'ILE;Site de la ville - www.ville-noirmoutier.fr;Décembre et janvier;Ouvert en 2012 du 11 février au 8 avril de 14h à 18h, du 9 avril au 8 mai de 11h à 18h, du 9 mai au 17 juin de 11h à 18h, du 18 juin au 18 septembre de 10h à 19h et du 19 septembre au 6 novembre de 13h à 18h;
Musée La Bourrine du Bois-Juquaud;4, Chemin du Bois Juquaud;85270;SAINT-HILAIRE-DE-RIEZ;Site de la ville : www.sainthilairederiez.fr;1er novembre, 25 décembre et 1er janvier;De février à mars du lundi au vendredi de 14h à 18h, avril du mardi au dimanche, et jours fériés de 14h à 18h, mai, juin et septembre du lundi au samedi de 10h à 12h et de 14h à 18h, dimanches et jours fériés de 15h à 19h, juillet-août du lundi au samedi;
Musée Milcendeau Jean-Yole;Le Bois Durand;85300;SOULLANS;www.musee-milcendeau.fr;1er novembre;Ouvert d'avril à juin, en septembre du mercredi au dimanche de 14h à 18h, en juillet-août tous les jours de 10h à 19h30 et le samedi de 14h à 19h30;
Musée Franco-Américain du Château de Blérancourt;Château;2300;BLERANCOURT;www.museefrancoamericain.fr;;;
Musée Jean de la Fontaine;12, Rue Jean de la Fontaine;2400;CHATEAU-THIERRY;www.musee-jean-de-la-fontaine.fr ou www.la-fontaine-ch-thierry.net;1er janvier, 1er mai, 1er novembre, 25 décembre;Ouvert du mardi au dimanche de 9h30 à 12h et de 14h à 17h30;
Musée municipal de Chauny;28, Rue de la Paix;2300;CHAUNY;http://www.ville-chauny.fr/culture/musee_presentation.php;;Ouvert mercredi et jeudi de 14h à 17h. Ouvert sur rendez-vous pour les groupes scolaires;
Familistère de Guise;265, Familistère Aile Droite;2120;GUISE;www.familistere.com;1er janvier, 25 décembre - Lors des fêtes de fin d'année;"Ouvert de septembre à juin du mardi au dimanche et jours fériés de 10h à 18h, en juillet-août tous les jours de 10h à 18h.
Visite guidée individuelle à 10h30, 14h30, 16h30";
Musée - Centre de Documentation Alfred Desmasures;Impasse du Château;2500;HIRSON;;;Ouvert lundi, mardi, jeudi, vendredi, samedi de 13h30 à 16h30, les matins, les mercredis et dimanches sur rendez-vous;
Musée Jeanne d'Aboville;5, Rue du Général de Gaulle;2800;LA FERE;http://perso.wanadoo.fr/lafere/musee.htm;1er janvier, 1er mai, 14 juillet, 1er novembre, 25 décembre;Ouvert en semaine pair mercredi et jeudi de 8h à 12h et de 14h à 18h, vendredi, samedi, dimanche de 14h à 18h et en semaine impair lundi, jeudi vendredi de 8h à 12h et de 14h à 18h, samedi et dimanche de 14h à 18h;
Musée Archéologique Municipal;32, Rue Georges Ermant;2000;LAON;www.ville-laon.fr;1er janvier, 1er mai, 14 juillet, 24,25 et 31 décembre;Ouvert du mardi au dimanche 1er juin au 30 septembre de 11h à 18h et du 1er octobre au 31 mai de 14h à 18h et le matin sur rendez-vous;
Musée Monseigneur Pigneau de Behaine;Rue du Musée;2550;ORIGNY-EN-THIERACHE;;;"Uniquement sur rendez-vous.
Ouvert à l'occasion de la nuit des musees et durant les journees europeennes du patrimoine";
Musée de la Vie Rurale et Forestière;"Site Abbatial
Rue du Chamiteau";2830;SAINT-MICHEL-EN-THIERACHE;www.abbaye-saintmichel.com;;Ouvert du 1er avril au 31 octobre du lundi au vendredi de 14h à 18h, le week-end et jours fériés de 14h30 à 18h30;
Musée Entomologique;"Espace Saint Jacques
14, Rue de la Sellerie";2100;SAINT-QUENTIN;Site de la ville;;Ouvert du mercredi au  lundi de 14h à 18h. Accueil des scolaires le matin sur rendez-vous;
Musée Antoine Lecuyer;28, Rue Antoine Lecuyer;2100;SAINT-QUENTIN;www.museeantoinelecuyer.fr/ ou www.mquentindelatour.com/;1er janvier, 1er mai, dimanche de la Pentecôte, 14 juillet, lundi de la Braderie en septembre, 1er novembre et 25 décembre;Ouvert lundi, mercredi, jeudi et vendredi de 10h à 12h et de 14h à 17h (18h en juillet-août), le samedi de 10h à 12h et de 14h à 18h, le dimanche de 14h à 18h;
Musée Municipal de Soissons;"Conservation
Abbaye Saint-Jean-des-Vignes
2, rue de la Congrégation
Logis de l'Abbé";2200;SOISSONS;www.musee-soissons.org;1er janvier, 25 décembre;Ouvert du 1er octobre au 31 mars du lundi au vendredi de 9h à 12h et de 14h à 17h, week-end et jours fériés de 14h à 18h  du 1er avril au 30 septembre du lundi au vendredi de 9h à 12h et de 14h à 18h, week-end et jours fériés de 14h à 19h;
Musée de la Résistance et de la Déportation;"Place Carnegie
Fargniers";2700;TERGNIER;www.resistance-deportation-picardie.com;1er mai, 1er  novembre et entre le 25 décembre et le 1er janvier;Ouvert du mardi au samedi de 9h à 12h et de 14h à 18h, le dimanche de 14h30 à 18h30;
Musée de La Thiérache;"3, 5 Rue du Traité de Paix
(Place du général de Gaulle)";2140;VERVINS;http://museedelathierache.jimdo.com ou www.evasion-aisne.com;;Ouvert d'octobre à mai du lundi midi au samedi midi de 9h à 12h30 et de 13h30 à 17h, de juin à septembre du mardi au samedi de 9h à 12h et de 14h à 18h et en juillet-août du mardi au samedi de 9h à 12h et de 14h à 18h;
Musée Alexandre Dumas;24, Rue Demoustiers;2600;VILLERS COTTERETS;Site de la mairie - www.mairie-villerscotterets.fr;Jours fériés;Ouvert du mercredi au lundi de 14h à 17h, dimanche de 14h à 18h;
Musée de la Céramique Architecturale;432, Avenue du Maréchal Foch;60390;AUNEUIL;www.annuaire-mairie.fr/musee-de-la-ceramique-architecturale.html;;Musée fermé au public;
Musée Départemental de l'Oise;"1, Rue Cambry
B.P. 941";60024;BEAUVAIS cedex;http://www.oise.fr/culture-et-vie-locale/le-musee-departemental/;1er janvier, lundi de Pâques, 1er mai, lundi de Pentecôte, 1er novembre, 25 décembre;Ouvert du lundi au dimanche de 10h à 12h et de 14h à 18h et du 1er juillet au 30 septembre de 10h à 18h;
Musée Pillon;"Salle du Patrimoine
Hôtel de Ville";60240;CHAUMONT-EN-VEXIN;http://museeraymondpillon.overblog.com ou http:flore-de-chaumont-en-vexin.overblog.com;;Le 3ème Week-end d'avril à octobre 10h à 12h et de 14h à 18h et sur rendez-vous pour les visites guidées;
Musée Antoine Vivenel;"Hôtel de Songeons-Bicquilley
2, Rue d'Austerlitz";60200;COMPIEGNE;www.musee-vivenel.fr;1er janvier, 1er mai, 14 juillet, 1er novembre et 25 décembre;Ouvert du mardi au dimanche de 10h à 13h et de 14h à 18h;
Musée du Château de Compiègne;Place du Général de Gaulle;60200;COMPIEGNE;www.musee-chateau-compiegne.fr;1er janvier, 1er mai, 25 décembre;"Ouvert du mercredi au lundi de 10h à 18h
Entre 12h30 et 13h30 les appartements de l'Empereur et de l'Impératrice sont uniquement accessibles en visite commentée sans supplément";
Musée national de la Voiture et du Tourisme (Annexe du musée National du Château de Compiègne);"Palais national
B.P. 549";60200;COMPIEGNE;www.musee-chateau-compiegne.fr;;Voir musée national de Compiègne;
Musée de la Figurine Historique;28, Place de l'Hôtel de Ville;60200;COMPIEGNE;www.musee-figurine.fr;1er janvier, 1er mai, 14 juillet, 1er novembre et 25 décembre;Ouvers de mars à octobre du mardi au dimanche de 9h à 12h et de 14h à 18h, de novembre à février du mardi au dimanche de 9h à 12h et de 14h à 17h;
Musée Gallé-Juillet;Place François Miterrand;60100;CREIL;site de la mairie - www.mairie-creil.fr;Jours fériés;"Ouvert du mercredi au samedi 14h à 17h avec des visites guidées obligatoires à 14h, 15h et 16h, le dimanche à 14h30 à 17h30.
Pour les groupes le mardi, et mercredi, jeudi, vendredi et samedi le matin sur rendez-vous";
Musée de l'Archerie et de l'Art Sacré;Rue Gustave Chopinet;60800;CREPY-EN-VALOIS;www.musee-archerie-valois.fr;Mi novembre à mi-mars, 1er mai;Ouvert du mercredi au lundi du dernier week-end de mars au 11 novembre de 14h à 18h;
Musée de la Nacre et de la Tabletterie;51, rue Roger Salengro;60110;MERU;www.musee-nacre.com;1er janvier, 1ère semaine de janvier, 25 décembre;"Ouvert du mercredi au lundi de 14h30 à 18h30 avec visite guidée à 15h, 16h ou 17h
Accueil des groupes le mardi et le matin en semaine";
Musée Calvin;6, Place Aristide Briand;60400;NOYON;www.ville-noyon.fr/Le-musee-Jean-Calvin.html;1er janvier, 11 novembre, 25 décembre;Ouvert du mardi au dimanche de 10h à 12h et de 14h à 18h, 17h du 1er novembre au 31 mars;
Musée du Noyonnais;7, Rue de l'Evêché;60400;NOYON;www.ville-noyon.fr/Le-musee-du-Noyonnais.html;1ermai , 11 novembre, du 25 décembre au 2 janvier;Ouvert du mardi au dimanche de 10h à 12h et de 14h à 18h, 17h du 1er novembre au 31 mars;
Musée d'Art et d'Archéologie;Place Notre Dame;60300;SENLIS;www.musees-senlis.fr;1er janvier, 1er mai, 25 décembre;Ouvert lundi, jeudi, vendredi de 10h à 12h et de 14h à 18h, mercredi de 14h à 18h, samedi, dimanche et jours fériés de 11h à 13h et de 14h à 18h;
Musée de la Vénerie;Place du Parvis Notre Dame;60300;SENLIS;Site de la ville;1er janvier, 1er mai, 25 décembre;Ouvert mardi de 14h à 18h, mercredi,  jeudi, vendredi de 10h à 12h et de 14h à 18h, samedi, dimanche et jours fériés de 11h à 13h et de 14h à 18h;
Musée Archéologique de l'Oise;Les Marmousets;60120;VENDEUIL-CAPLY;www.m-a-o.org;;Ouvert du 1er mai au 30 septembre tous les jours de 14h à 19h, et du 1er octobre au 30 mars les samedis, dimanches et vacance de zone B de 14h à 18h30;
Musée Boucher-de-Perthes;24, Rue Gontier-Patin;80100;ABBEVILLE;Site de la ville;;Ouvert du mercredi au lundi de 14h à 18h. Pour les groupes, autres horaires possibles sur rendez-vous du lundi au vendredi matin;
Musée Départemental de l'Abbaye de Saint-Riquier;B.P. 40003 Saint-Riquier;80146;ABBEVILLE Cedex;www.somme.fr;;Ouvert tlj du 19 mars au 29 avril et du 1er octobre au 18 novembre de 14h à 18h. Week-end et jours fériés de 10h à 12h et de 14h à 18h. Du 30 avril au 30 septembre tlj de 10h à 18h du 24 novembre au 16 décembre, vendredi, xeek-end de 14h à 18h;
Muséum d'histoire naturelle;;80000;AMIENS;;;;
Musée de l'Hôtel de Berny;36, Rue Victor Hugo;80000;AMIENS;www.amiens.com;;;
Musée de Picardie;48, Rue de la République;80000;AMIENS;www.amiens.fr/musees;1er janvier, 1er & 11 novembre, 25 décembre;Ouvert mardi, vendredi, samedi de 10h à 12h et de 14h à 18h, mercredi de 10h à 18h, jeudi de 10h à 12h et de 14h à 21h, dimanche de 14h à 19h;Jusqu'à 21h le jeudi
Musée Lombart;7, Rue du Musée;80600;DOULLENS;http://mairie-doullens.pagesperso-orange.fr/zone1/pageLibre00010098.html;;Ouvert du mardi au vendredi de 14h à 17h, sur rendez-vous le matin, le samedi et le premier dimanche du mois de 10h à 12h et de 14h à 17h.;
Musée Alfred Danicourt;"Hôtel de Ville
B.P. 20045";80201;PERONNE Cédex;Site internet de la ville www.ville-peronne.fr ou http://www.haute-somme.com/danicourt/;;Ouvert du mardi au vendredi de 14h à 17h30, le samedi de 9h à 12h et de 14h à 16h30. Le matin sur rendez-vous les mercredi jeudi et vendredi;
Musée-Historial de la Grande Guerre;"Château de Péronne
B.P. 20063";80201;PERONNE Cédex;www.historial.org;1er au 15 janvier et 17 au 31 décembre;Ouvert tous les jours de de 9h30 à 18h du 1er avril au 30 septembre et de 9h30 à 17h du 1er octobre au 31 mars;
Musée Archéologique et Historique;44, Rue de Montmoreau;16000;ANGOULEME;site de société archéologique - www.sahc-charente.org;;;
Atelier - Musée du Papier;134, Rue de Bordeaux;16000;ANGOULEME;www.alienor.org;Jours fériés;Ouvert du 1er septembre au 30 juin du mardi au vendredi de 10h à 12h et de 14h à 18h, samedi et dimanche de 14h à 18h et du 1er juillet au 30 août du mardi au dimanche de 12h à 18h30;
Musée des Beaux-Arts;1, rue de Friedland;16000;ANGOULEME;Site collectif du CMPC : www.Alienor.org;1er janvier, 1er mai, 1er novembre, 25 décembre;Ouvert du mardi au dimanche de 10h à 18h;
Musée de la Bande Dessinée - Centre National de la Bande Dessinée et de l'Image;"121, Rue de Bordeaux
B.P. 72308";16023;ANGOULEME Cedex;www.cnbdi.fr ou www.alienor.org;1er janvier, 1er mai, 25 décembre;Ouvert de septembre à juin du mardi au vendredi de 10h à 18h, samedi, dimanche et jours fériés de 14h à 18h,  en juillet-août de 10h à 19h, samedi, dimanche, 14 juillet et 15 août de 14h à 19h;
Musée des Arts du Cognac;"Les Remparts
Place de la Salle Verte";16100;COGNAC;www.musees-cognac.fr;1er janvier, 1er mai, 1er novembre, 25 décembre;Ouvert en juillet-août du mardi au dimanche de 10h à 18h30, en mai, juin et septembre du mardi au vendredi de 11h à 18h et samedi et dimanche de 13h à 18h, d'octobre à avril du mardi au dimanche de 14h à 17h30;
Musée Municipal de Cognac;48, Bd Denfert Rochereau;16100;COGNAC;www.musees-cognac.fr;1er janvier, 1er mai, 1er novembre, 25 décembre;Ouvert en juillet-août du mercredi au lundi de 10h à 18h30, en mai, juin et septembre lundi, mercredi au vendredi de 11h à 18h et le samedi et dimanche de 13h à 18h, d'octobre à avril du mercredi au lundi de 14h à 17h30;
Musée de la Mytiliculture;Parvis de l'Eglise;17137;ESNANDES;www.maison-baiemaraispoitevin.fr;;Ouvert en juillet-août tous les jours de 10h à 18h, durant les vacances scolaires (toutes zones) et en septembre tous les jours de 10h à 12h30 et de 13h30 à 18h, de mai à juin et octobre (hors vacances) mercredi, samedi et dimanche de 14h à 18h;
Musée Régional de Fouras;"B.P. 75
Place du Sémaphore";17450;FOURAS;http://musee.fouras.assoc.pagespro-orange.fr/;;Ouvert tous les samedis, dimanches et jours fériés de 14h30 à 17h30 hors saison, durant les vacances scolaires toutes zones du mardi au dimanche de 14h30 à 17h30, du 1er juin au 15 septembre de 10h à 12h et de 15h à 18h30 et le lundi après-midi;
Musée Napoléonien et Africain;Rue Napoléon;17123;ILE D'AIX;www.musees-nationaux-napoleoniens.org/index.htm;1er janvier, 25 décembre;Ouvert du 1er avril au 30 septembre tous les jours de 9h30 à 12h et de 14h à 18h, du 1er au 31 octobre du mercredi au lundi de 9h30 à 12h et de 14h à 18h, du 1er novembre au 31 mars du mercredi au lundi de 9h30 à 12h et de 14h à 17h;
Muséum d'Histoire Naturelle;28, Rue Albert 1er;17000;LA ROCHELLE;www.museum-larochelle.fr;25 décembre, 1er janvier et 1er mai;Ouvert d'octobre à mi mai du mardi au vendredi de 9h à 18h, samedi dimanche et jours fériés de 14h à 18h, 1er samedi du moi de 14h à 21h, 1er dimanche du mois de 9h à 18h, et de mi-mai à septembre du mardi au vendredi de 10h à 19h, samedi dimanche et jour;Premiers samedis de 10h à 21h de janvier à juin
Musée Protestant;2, Rue Saint-Michel;17000;LA ROCHELLE;www.protestantisme-museelarochelle.fr;;Ouvert du 22 juin au 21 septembre du lundi au samedi de 14h30 à 18h, et sur rendez-vous en dehors de la saison;
Musée d'Orbigny-Bernon;2, Rue Saint-Côme;17000;LA ROCHELLE; www.alienor.org;;Ouvert du 1er octobre au 30 juin le lundi, mercredi, jeudi, vendredi de 9h30 à 12h30 et de 13h30 à 17h, week-end de 14h à 18h et du 1erjuillet au 30 septembre de 10h à 13h et de 13h45 à 18h, week-end de 14h à 18h;
Musée du Nouveau Monde;10, Rue Fleuriau;17000;LA ROCHELLE;www.alienor.org;;Ouvert du 1er octobre au 30 juin le lundi, mercredi, jeudi, vendredi de 9h30 à 12h30 et de 13h30 à 17h, week-end de 14h à 18h et du 1erjuillet au 30 septembre de 10h à 13h et de 13h45 à 18h, week-end de 14h à 18h;
